name,location,date,time,description,category,link
Mental Health Advocates: Call for NAMI Metro Suburban Finance Committee Volunteers!,Oak Park,3/17/2024,11:00 AM,Join the NAMI Metro Suburban Finance Committee as a volunteer. Help advocate for mental health initiatives and support financial planning for community programs.,"['Mental Health', 'Finance', 'Advocacy']",https://www.volunteermatch.org/search/opp3891274.jsp
Administrative Assistant Needed ASAP!,Chicago,3/19/2024,9:00 AM,"Provide administrative support to The Rise Foundation. Assist with daily operations, data entry, and other tasks to help the organization run smoothly.","['Administration', 'Community Development', 'Nonprofit Support']",https://www.volunteermatch.org/search/opp3642687.jsp
Event Volunteer Help!,"Chicago, IL, USA",3/15/2024,10:00 AM,Join TRANSFORMATIONS BY CHICAGO ANGELS as an event volunteer. Assist with various tasks to support the event's success.,"['Volunteering', 'Community Development']",https://www.volunteermatch.org/search/opp3887832.jsp
Board of Directors - Social Media and Marketing,"Chicago, IL, USA",3/16/2024,2:00 PM,Contribute to TRANSFORMATIONS BY CHICAGO ANGELS as a Board member focusing on social media and marketing strategies.,"['Marketing', 'Nonprofit Management']",https://www.volunteermatch.org/search/opp3887826.jsp
Back to School Drive Volunteer,"Chicago, IL, USA",3/17/2024,11:00 AM,Assist NAAAP-Chicago with their Back to School Drive to help prepare for the upcoming school year.,"['Education', 'Community Development']",https://www.volunteermatch.org/search/opp3887765.jsp
Play a musical instrument for memory support residents!,"Chicago, IL, USA",3/18/2024,3:00 PM,"Volunteer with norVOLution to play musical instruments for memory support residents, providing entertainment and engagement.","['Health & Medicine', 'Arts & Music']",https://www.volunteermatch.org/search/opp3887119.jsp
Lead craft activities with memory support residents!,"Chicago, IL, USA",3/19/2024,4:00 PM,"Assist norVOLution in leading craft activities for memory support residents, promoting creativity and well-being.","['Health & Medicine', 'Arts & Crafts']",https://www.volunteermatch.org/search/opp3835739.jsp
Become a host family for an international exchange student!,"River Forest, IL, USA",3/20/2024,5:00 PM,"Host an international exchange student through AnB Education, providing a welcoming environment for cultural exchange.","['Education', 'International Relations']",https://www.volunteermatch.org/search/opp3688802.jsp
Digital Marketing Specialist,"Chicago, IL, USA",3/21/2024,6:00 PM,Help the American Youth Literacy Foundation with digital marketing efforts to promote literacy programs.,"['Marketing', 'Education']",https://www.volunteermatch.org/search/opp3886540.jsp
Mentor,"Chicago, IL, USA",3/22/2024,7:00 PM,"Mentor individuals through The Well of Mercy, providing guidance and support for personal development.","['Mentorship', 'Community Development']",https://www.volunteermatch.org/search/opp3886305.jsp
Family Mentors for Newcomers,"Skokie, IL, USA",3/23/2024,8:00 PM,"Assist BUILDING PEACEFUL BRIDGES in mentoring families, helping them integrate into the community.","['Community Development', 'Immigrants or Refugees']",https://www.volunteermatch.org/search/opp3323705.jsp
Event Planning Committee for the 2025 Walk to End Alzheimer's,"Chicago, IL, USA",3/24/2024,9:00 PM,Join the Alzheimer's Association Illinois Chapter to help plan the 2025 Walk to End Alzheimer's event.,"['Health & Medicine', 'Event Planning']",https://www.volunteermatch.org/search/opp3885641.jsp
OPEN CALL for new performers,"Chicago, IL, USA",3/25/2024,10:00 PM,SECOND CITY OUTLAWS INC seeks new performers to join their team. Audition and showcase your talents.,"['Arts & Music', 'Entertainment']",https://www.volunteermatch.org/search/opp3765589.jsp
